801/cleantext/017-Adaptive-path-following-control-for-miniature-unmanned-aerial-v_2023_ISA-Tra/tables/table_006.csv

MAV No.,Path- following,Accuracy comparison,Efficiency comparison (unit: s)
,control method,Take- off (m),Cruising (m),Landing (m),(Average transient time of participant controllers)
1,ASMC,4.90,3.20,4.30,3.32
,PID,15.3,3.10,16.2,5.71
,LQR,37.6,28.9,38.3,10.2
2,ASMC,6.70,4.70,5.20,3.9
,PID,17.1,4.60,18.5,5.31
,LQR,38.7,29.1,43.9,9.47

801/cleantext/017-Adaptive-path-following-control-for-miniature-unmanned-aerial-v_2023_ISA-Tra/clean_body.md

## 4.2. Real flight experiment

In the take-off and landing process, the influences induced by the MAV’s unstable and dramatic state change activate the ASMC-based VF and apparently cause the ASMC-based VF to outperform the LQR-based and PID-based path, followed by attaining severe advances. For control accuracy part, remarkably, even the PID-based VF achieves 20 m and 25 m smaller following errors than the LQR-based controller for MAV1 and MAV2, respectively, representing an improvement of approximately 59%. In spite of this, the proposed adaptive SMC-based VF reduces the error to below 7 m by compensating for wind disturbances, unmodeled dynamics, and an unsafe flight period consisting of both an orbit path and a helical path, which are reduced by 68% and 87%, respectively, when compared to PID controller-based VF and LQR-based path following. For control efficiency part, we choose the average transition time of the three controllers in the whole flight process as the factor to evaluate their control efficiency; according the results presented in Table 7, for MAV1 involved case, the average transition time of ASMC controller, LQR controller and PID classic controller is 3.32 s, 10.2 s and 5.71 s respectively, and for MAV2 involved case, the corresponding average transition time is 3.9 s, 9.47 s and 5.31 s, respectively. That is to say, compared with the other two controllers, the ASMC controller has faster response efficiency for path tracking and can adjust the MAV to the scheduled path in a shorter time. Consequently, for a fixed-wing MAV with limited capabilities, the validation of the ASMC-based VF algorithm’s superiority in tracking a 3D Dubins route from take-off to landing process makes it a more viable option.