801/cleantext/041-The-innovation-of-an-aerodynamic-heat-harvest-TEG-consider_2025_Applied-Ther/tables/table_005.csv

Contacting pair,Clearance medium,Average interfacial temperature (K),Equivalent thermal conductivity (W/(m·K)),Average interfacial electrical potential (V),Equivalent electrical conductivity (S/mm)
E-N,Air,386.3,0.6719,4.473,2.760
473.8,0.7074,5.219,2.762
562.6,0.7074,5.964,2.761
653.1 745.2,0.7574,6.709,2.762
,0.8297,7.455,2.763
Silver-epoxy adhesive,399.0,14.10,5.975,269.9
498.0,14.67,6.970,269.6
597.0,14.82,7.966,270.7
695.8,14.81,8.962,270.0
,Air,794.5,14.68,9.958,269.3
389.9,0.7691,5.027,4.940
480.7,0.7835,5.864,4.942
572.8,0.8207,6.702,4.943
666.6 762.0,0.8988,7.540,4.941
,399.3,1.024,8.378,4.945
498.6,15.00 16.10,5.989 6.987,625.5 623.2
597.9,16.01,7.985,626.8
697.1,16.51,8.984,631.8
796.3,16.46,9.982,625.5

801/cleantext/041-The-innovation-of-an-aerodynamic-heat-harvest-TEG-consider_2025_Applied-Ther/clean_body.md

## 3.3. Equivalent interfacial layers in TEG

Table 4 lists the equivalent thermal and electrical conductivities of contacting pairs at 0.1 MPa which corresponding to TCR and ECR at 0.14 MPa, and the pressure ratio keeps consistent with the crosssectional area ratio of TE legs and TEG. The equivalent thermal conductivity changes from 0.6719 to 14.68 W/(m⋅K) under air clearance, from 14.10 to 16.46 W/(m⋅K) under the silver-epoxy adhesive clearance. The equivalent electrical conductivity varies from 2.760 to 4.945 S/mm under air clearance, from 269.9 to 625.5 S/mm under the silver-epoxy adhesive clearance. It can be seen that the silver-epoxy adhesive clearance can substantially increase the equivalent thermal and electrical conductivities.