801/cleantext/045-Tolerance-indicating-models-of-non-thermal-and_2024_International-Journal-of/tables/table_009.csv

Sample No.,β,Tf(K),Tt(K),V (%)
1,13.5,373,478,10.98
2,13.5,378,483,6.93
3,13.5,383,488,3.55
4,14.5,373,471,15.7
5,14.5,378,476,13.14
6,14.5,383,481,9.4
7,15.5,373,464,21.7
8,15.5,378,469,16.93
9,15.5,383,474,13.92

801/cleantext/045-Tolerance-indicating-models-of-non-thermal-and_2024_International-Journal-of/clean_body.md

## 6.3.2. The thermal damage tolerance

0.90%, − 1.50%, and − 4.82% for $T _ {\mathrm{avg}} , T _ {\mathrm{max}} ,$ and $s _ {T} ,$ respectively, when the damage volume fraction is larger than 10.98% (sample $1 ) ; \left( \mathbf {b} \right) T _ {\mathrm{avg}}$ has the best prediction with the maximum deviation of 1.2%, because it is the average result of the HT path; (c) The prediction accuracy of $T _ {\mathrm{max}}$ and $S _ {T}$ improves with increasing β and decreasing $T _ {\mathrm{f}} ( \mathrm{i.e.} _ {\cdot}$ , increasing V). The deviation of $T _ {\mathrm{max}}$ is less than 6% when $V$ is greater than 6.93% (sample 2), while the deviation of $S _ {T}$ is less than 5% when V is greater than 10.98% (sample 1); (d) The damage tolerance is increasing with decreasing β and increasing $T _ {\mathrm{f}} \left( \mathrm{i.e.,} \right$ , decreasing $V ,$ the maximum damage tolerance is 0.787 for sample 3 with $\beta = 13.5$ and $T _ {\mathrm{f}} = 383 \ \mathrm{K} ,$ the minimum damage tolerance is 0.13 for sample 7 with $\beta = 15.5$ and $T _ {\mathrm{f}} =$ 373 K.

## 6.3.3. The relationships between volume fraction and damage tolerance

Based on the studies of non-thermal and thermal damages above, Fig. 21 shows the relationships between volume fraction and damage tolerance. The non-thermal damage tolerance $E _ {\mathrm{nt}}$ and thermal damage tolerance $E _ {\mathrm{t}}$ are obtained by Eqs. (27) and (28), respectively. Orange circles represent the results for forty samples of non-thermal damage, with a polynomial fitting result of $E _ {\mathrm{nt}}$ shown by the orange dashed line. Blue triangles represent the results for nine samples of thermal damage, with a polynomial fitting result of $E _ {\mathrm{t}}$ shown by the blue line. The temperature distributions of HT paths with non-thermal damage of $V =$ 13.48%, and thermal damage of $V = 13.14 \%$ are also shown in Fig. 21. It can be found that variations of non-thermal and thermal damage tolerance along with the volume fractions are similar, but $E _ {\mathrm{t}}$ is less than $E _ {\mathrm{nt}}$ with the same volume fraction, which indicates that for the dendric HT path, the tolerance of non-thermal damage is better than that of thermal damage under the same damage level.

## The results show some conclusions:

5. The tolerances of thermal damages vary between 0.13 and 0.787 when $\beta$ and $T _ {\mathrm{f}}$ vary between 13.5 to 15.5 and 373 K to 383 K; the maximum deviations of the damage model are $0.90 \% , - 1.50 \%$ , and − 4.82% for average $T _ {\mathrm{avg}} , \ T _ {\mathrm{max}} ,$ , and $s _ {T} ,$ respectively, when the damage volume fraction is larger than 10.98%.